edid-decode (hex):

00 ff ff ff ff ff ff 00 06 0b 0f 00 0f 00 00 00
00 24 01 04 a0 07 0e 78 0e ee 91 a3 54 4c 99 26
0f 50 54 00 00 00 01 01 01 01 01 01 01 01 01 01
01 01 01 01 01 01 50 78 a0 a0 50 30 59 c0 30 20
38 00 41 8e 00 00 00 1a 00 00 00 fd 00 18 78 1e
ff 42 00 0a 20 20 20 20 20 20 00 00 00 fc 00 41
50 4b 52 75 6e 20 31 35 0a 20 20 20 00 00 00 10
00 00 00 00 00 00 00 00 00 00 00 00 00 00 00 5a

----------------

Block 0, Base EDID:
  EDID Structure Version & Revision: 1.4
  Vendor & Product Identification:
    Manufacturer: APK
    Model: 15
    Serial Number: 15 (0x0000000f)
    Made in: 2026
  Basic Display Parameters & Features:
    Digital display
    Bits per primary color channel: 8
    Digital interface is not defined
    Maximum image size: 7 cm x 14 cm
    Gamma: 2.20
    Supported color formats: RGB 4:4:4, YCrCb 4:4:4
    Default (sRGB) color space is primary color space
    First detailed timing includes the native pixel format and preferred refresh rate
  Color Characteristics:
    Red  : 0.6396, 0.3300
    Green: 0.2998, 0.5996
    Blue : 0.1503, 0.0595
    White: 0.3125, 0.3291
  Established Timings I & II: none
  Standard Timings: none
  Detailed Timing Descriptors:
    DTD 1:  1440x3120   59.987535 Hz   6:13   192.500 kHz    308.000000 MHz (65 mm x 142 mm)
                 Hfront   48 Hsync  32 Hback   80 Hpol P
                 Vfront    3 Vsync   8 Vback   78 Vpol N
    Display Range Limits:
      Monitor ranges (GTF): 24-120 Hz V, 30-255 kHz H, max dotclock 660 MHz
    Display Product Name: 'APKRun 15'
    Dummy Descriptor:
Checksum: 0x5a
