edid-decode (hex):

00 ff ff ff ff ff ff 00 06 0b 00 00 00 00 00 00
00 24 01 04 a0 10 0c 78 0e ee 91 a3 54 4c 99 26
0f 50 54 00 00 00 01 01 01 01 01 01 01 01 01 01
01 01 01 01 01 01 e0 15 00 a0 40 00 16 30 30 20
38 00 a3 7a 00 00 00 1a 00 00 00 fd 00 18 78 1e
ff 42 00 0a 20 20 20 20 20 20 00 00 00 fc 00 41
50 4b 52 75 6e 20 30 0a 20 20 20 20 00 00 00 10
00 00 00 00 00 00 00 00 00 00 00 00 00 00 00 bf

----------------

Block 0, Base EDID:
  EDID Structure Version & Revision: 1.4
  Vendor & Product Identification:
    Manufacturer: APK
    Model: 0
    Made in: 2026
  Basic Display Parameters & Features:
    Digital display
    Bits per primary color channel: 8
    Digital interface is not defined
    Maximum image size: 16 cm x 12 cm
    Gamma: 2.20
    Supported color formats: RGB 4:4:4, YCrCb 4:4:4
    Default (sRGB) color space is primary color space
    First detailed timing includes the native pixel format and preferred refresh rate
  Color Characteristics:
    Red  : 0.6396, 0.3300
    Green: 0.2998, 0.5996
    Blue : 0.1503, 0.0595
    White: 0.3125, 0.3291
  Established Timings I & II: none
  Standard Timings: none
  Detailed Timing Descriptors:
    DTD 1:  1024x768    59.869997 Hz   4:3     47.297 kHz     56.000000 MHz (163 mm x 122 mm)
                 Hfront   48 Hsync  32 Hback   80 Hpol P
                 Vfront    3 Vsync   8 Vback   11 Vpol N
    Display Range Limits:
      Monitor ranges (GTF): 24-120 Hz V, 30-255 kHz H, max dotclock 660 MHz
    Display Product Name: 'APKRun 0'
    Dummy Descriptor:
Checksum: 0xbf
